MaterialTypeUniqueID,Material_Classification,Material_Details_JPN,inconsistent,Materials_Details_EN,Materials_Detail_Identification_EN,Materials_Detail_Other_EN,Materials_Detail_Notes_EN
321,Wood,両端加工材(ヌルデ),0,material worked wood Chinese sumac (Brucea javanica syn. Rhus)​,Chinese sumac (Brucea javanica syn. Rhus)​,material worked wood,
322,Wood,両端加工材(ムラサキシキブ属),0,material worked wood beautyberry (Callicarpa sp.),beautyberry (Callicarpa sp.),material worked wood,
323,Wood,丸太杭,0,round wood wooden stake,,round wood wooden stake,
324,Wood,丸木材,0,material wood log/trunk,,material wood log/trunk,
325,Wood,丸木杭(エゴノキ属),0,log/trunk wooden stake wooden stake snowbell tree (Styrax sp.),snowbell tree (Styrax sp.),log/trunk wooden stake wooden stake,
326,Wood,丸木杭(クリ),0,log/trunk wooden stake wooden stake chestnut (Castanea crenata),chestnut (Castanea crenata),log/trunk wooden stake wooden stake,
327,Wood,丸木杭(クロモジ属),0,log/trunk wooden stake wooden stake spicebush (Lindera umbellata),spicebush (Lindera umbellata),log/trunk wooden stake wooden stake,
328,Wood,丸木杭(チドリノキ),0,log/trunk wooden stake wooden stake hornbeam maple (Acer carpinifolium),hornbeam maple (Acer carpinifolium),log/trunk wooden stake wooden stake,
329,Wood,丸木杭(ヌルデ),0,log/trunk wooden stake wooden stake Chinese sumac (Brucea javanica syn. Rhus)​,Chinese sumac (Brucea javanica syn. Rhus)​,log/trunk wooden stake wooden stake,
330,Wood,丸木杭(モモ),0,log/trunk wooden stake wooden stake peach (Amygdalus persica syn. Prunus),peach (Amygdalus persica syn. Prunus),log/trunk wooden stake wooden stake,
331,Wood,丸木杭(ヤナギ属),0,log/trunk wooden stake wooden stake willow (Salix sp.),willow (Salix sp.),log/trunk wooden stake wooden stake,
332,Wood,丸木舟1号(ヒノキ属),0,log/trunk boat /canoe cypress (Chamaecyparis sp.),cypress (Chamaecyparis sp.),log/trunk boat /canoe,
333,Wood,丸木舟2号(ヒノキ属),0,log/trunk boat /canoe cypress (Chamaecyparis sp.),cypress (Chamaecyparis sp.),log/trunk boat /canoe,
334,Wood,乾燥木材,0,material wood desiccated,,material wood desiccated,
374,Wood,倒木(ヤマグワ),0,fallen tree Chinese mulberry (Morus australis syn bombycis),Chinese mulberry (Morus australis syn bombycis),fallen tree,
376,Wood,先端加工材(イヌガヤ),0,material worked wood plum yew (Cephalotaxus harringtonia),plum yew (Cephalotaxus harringtonia),material worked wood,
377,Wood,先端加工材(ウメ),0,worked tip of wood (Prunus sp.),,material worked wood,
379,Wood,出土木（枝）,0,branch excavated tree,,branch excavated tree,
380,Wood,出土木（葉）,0,excavated tree,,excavated tree,
381,Wood,出土木製品（軸）,0,excavated tree wooden items,,excavated tree wooden items,
384,Wood,割り木,0,split tree,,,
385,Wood,割枕,0,bedding material? Again totally stumped on this,,,
386,Wood,加工材(クヌギ節),0,material worked wood saw-tooth oak (Quercus acutissima),saw-tooth oak (Quercus acutissima),material worked wood,
387,Wood,加工材(モモ),0,material worked wood peach (Amygdalus persica syn. Prunus),peach (Amygdalus persica syn. Prunus),material worked wood,
408,Wood,土器付着木質,0,from pottery residue,,from pottery residue,
719,Wood,土壌,1,soil,,soil,
762,Wood,埋もれ木,0,buried wood,,,
806,Wood,小枝,0,twig branch,,twig branch,
807,Wood,小枝材,0,material twig branch,,material twig branch,
817,Wood,常緑広葉樹 葉片および木材化石,0,material wood fossil wood hardwood,,material wood fossil wood hardwood,
818,Wood,建築部材,0,material,,material,
822,Wood,微細植物片,0,plant fragments,,plant fragments,
823,Wood,掘り棒,0,digging stick,,,
855,Wood,木,0,wood,,,
856,Wood,木(カエデ属),0,maple (Acer sp.),maple (Acer sp.),,
857,Wood,木(クリ),0,chestnut (Castanea crenata),chestnut (Castanea crenata),,
858,Wood,木(ケヤキ),0,Japanese zelkova (Zelkowa serrata),Japanese zelkova (Zelkowa serrata),,
859,Wood,木(コナラ属コナラ亜属クヌギ節),0,oak (Quercus sp.) saw-tooth oak (Quercus acutissima),oak (Quercus sp.) saw-tooth oak (Quercus acutissima),,
860,Wood,木(トウヒ属),0,spruce (Picea sp.),spruce (Picea sp.),,
861,Wood,木(トネリコ属),0,Ash (Fraxinus sp.),Ash (Fraxinus sp.),,
862,Wood,木(ムクノキ),0,oriental elm (Aphananthe aspera),oriental elm (Aphananthe aspera),,
863,Wood,木（倒木）,0,fallen tree,,fallen tree,
864,Wood,木(広葉樹),0,hardwood,,hardwood,
865,Wood,木（杭）,0,wood stake,,wooden stake,
866,Wood,木（柵の縦木）,0,wooden fence stake,,,
867,Wood,木（細杭）,0,thin stake,,wooden stake,
874,Wood,木本遺体屑,0,woody,,woody,
875,Wood,木材,1,material wood,,material wood,
876,Wood,木材 ウルシ,0,material wood poison oak/ivy (Toxicodendron sp.),poison oak/ivy (Toxicodendron sp.),material wood,
877,Wood,"木材,",0,material wood,,material wood,
878,Wood,木材，J-Cal,0,material wood,,material wood,
879,Wood,木材，ウイグルマッチング，,0,material wood C14 wiggle matching sample,,material wood C14 wiggle matching sample,
880,Wood,木材，ウイグルマッチング，-20,0,material wood C14 wiggle matching sample,,material wood C14 wiggle matching sample,
881,Wood,木材，ウイグルマッチング，-30,0,material wood C14 wiggle matching sample,,material wood C14 wiggle matching sample,
882,Wood,木材，ウイグルマッチング，-90,0,material wood C14 wiggle matching sample,,material wood C14 wiggle matching sample,
883,Wood,木材，ウイグルマッチング，0,0,material wood C14 wiggle matching sample,,material wood C14 wiggle matching sample,
884,Wood,木材，ウイグルマッチング，1,0,material wood C14 wiggle matching sample,,material wood C14 wiggle matching sample,
885,Wood,木材，ウイグルマッチング，1-5,0,material wood C14 wiggle matching sample,,material wood C14 wiggle matching sample,
886,Wood,木材，ウイグルマッチング，1〜5,0,material wood C14 wiggle matching sample,,material wood C14 wiggle matching sample,
887,Wood,木材，ウイグルマッチング，10,0,material wood C14 wiggle matching sample,,material wood C14 wiggle matching sample,
888,Wood,木材，ウイグルマッチング，11-15,0,material wood C14 wiggle matching sample,,material wood C14 wiggle matching sample,
889,Wood,木材，ウイグルマッチング，1年輪目,0,material wood year ring C14 wiggle matching sample,,material wood year ring C14 wiggle matching sample,
890,Wood,木材，ウイグルマッチング，20,0,material wood C14 wiggle matching sample,,material wood C14 wiggle matching sample,
891,Wood,木材，ウイグルマッチング，21-25,0,material wood C14 wiggle matching sample,,material wood C14 wiggle matching sample,
892,Wood,木材，ウイグルマッチング，30,0,material wood C14 wiggle matching sample,,material wood C14 wiggle matching sample,
893,Wood,木材，ウイグルマッチング，31,0,material wood C14 wiggle matching sample,,material wood C14 wiggle matching sample,
894,Wood,木材，ウイグルマッチング，31〜35,0,material wood C14 wiggle matching sample,,material wood C14 wiggle matching sample,
895,Wood,木材，ウイグルマッチング，36〜39,0,material wood C14 wiggle matching sample,,material wood C14 wiggle matching sample,
896,Wood,木材，ウイグルマッチング，40,0,material wood C14 wiggle matching sample,,material wood C14 wiggle matching sample,
897,Wood,木材，ウイグルマッチング，41,0,material wood C14 wiggle matching sample,,material wood C14 wiggle matching sample,
898,Wood,木材，ウイグルマッチング，45,0,material wood C14 wiggle matching sample,,material wood C14 wiggle matching sample,
899,Wood,木材，ウイグルマッチング，50,0,material wood C14 wiggle matching sample,,material wood C14 wiggle matching sample,
900,Wood,木材，ウイグルマッチング，61,0,material wood C14 wiggle matching sample,,material wood C14 wiggle matching sample,
901,Wood,木材，ウイグルマッチング，70,0,material wood C14 wiggle matching sample,,material wood C14 wiggle matching sample,
902,Wood,"木材，ウイグルマッチング，クスノキ,",0,material wood C14 wiggle matching sample camphor tree (Cinnamomum camphora),camphor tree (Cinnamomum camphora),material wood C14 wiggle matching sample,
903,Wood,"木材，ウイグルマッチング，クスノキ,内から105層",0,material wood C14 wiggle matching sample camphor tree (Cinnamomum camphora),camphor tree (Cinnamomum camphora),material wood C14 wiggle matching sample,
904,Wood,"木材，ウイグルマッチング，クスノキ,内から25層",0,material wood C14 wiggle matching sample camphor tree (Cinnamomum camphora),camphor tree (Cinnamomum camphora),material wood C14 wiggle matching sample,
905,Wood,"木材，ウイグルマッチング，クスノキ,内から45層",0,material wood C14 wiggle matching sample camphor tree (Cinnamomum camphora),camphor tree (Cinnamomum camphora),material wood C14 wiggle matching sample,
906,Wood,"木材，ウイグルマッチング，クスノキ,内から5層",0,material wood C14 wiggle matching sample camphor tree (Cinnamomum camphora),camphor tree (Cinnamomum camphora),material wood C14 wiggle matching sample,
907,Wood,"木材，ウイグルマッチング，クスノキ,内から65層",0,material wood C14 wiggle matching sample camphor tree (Cinnamomum camphora),camphor tree (Cinnamomum camphora),material wood C14 wiggle matching sample,
908,Wood,"木材，ウイグルマッチング，クスノキ,内から85層",0,material wood C14 wiggle matching sample camphor tree (Cinnamomum camphora),camphor tree (Cinnamomum camphora),material wood C14 wiggle matching sample,
909,Wood,"木材，ウイグルマッチング，ムクロジ,外から11年目",0,material wood C14 wiggle matching sample from outermost soapberry (Sapindaceae),soapberry (Sapindaceae),material wood C14 wiggle matching sample from outermost,
910,Wood,"木材，ウイグルマッチング，ムクロジ,外から1年目",0,material wood C14 wiggle matching sample from outermost soapberry (Sapindaceae),soapberry (Sapindaceae),material wood C14 wiggle matching sample from outermost,
911,Wood,"木材，ウイグルマッチング，ムクロジ,外から21年目",0,material wood C14 wiggle matching sample from outermost soapberry (Sapindaceae),soapberry (Sapindaceae),material wood C14 wiggle matching sample from outermost,
912,Wood,"木材，ウイグルマッチング，ムクロジ,外から31年目",0,material wood C14 wiggle matching sample from outermost soapberry (Sapindaceae),soapberry (Sapindaceae),material wood C14 wiggle matching sample from outermost,
913,Wood,"木材，ウイグルマッチング，ムクロジ,外から41年目",0,material wood C14 wiggle matching sample from outermost soapberry (Sapindaceae),soapberry (Sapindaceae),material wood C14 wiggle matching sample from outermost,
914,Wood,"木材，ウイグルマッチング，ムクロジ,外から51年目",0,material wood C14 wiggle matching sample from outermost soapberry (Sapindaceae),soapberry (Sapindaceae),material wood C14 wiggle matching sample from outermost,
915,Wood,"木材，ウイグルマッチング，モミ属,最外11年目",0,material wood outermost C14 wiggle matching sample fir (Abies sp.),fir (Abies sp.),material wood outermost C14 wiggle matching sample,
916,Wood,"木材，ウイグルマッチング，モミ属,最外1年目",0,material wood outermost C14 wiggle matching sample fir (Abies sp.),fir (Abies sp.),material wood outermost C14 wiggle matching sample,
917,Wood,"木材，ウイグルマッチング，モミ属,最外21年目",0,material wood outermost C14 wiggle matching sample fir (Abies sp.),fir (Abies sp.),material wood outermost C14 wiggle matching sample,
918,Wood,木材，ウイグルマッチング，中心から16年輪,0,material wood year ring C14 wiggle matching sample from center,,material wood year ring C14 wiggle matching sample from center,
919,Wood,木材，ウイグルマッチング，中心から26年輪,0,material wood year ring C14 wiggle matching sample from center,,material wood year ring C14 wiggle matching sample from center,
920,Wood,木材，ウイグルマッチング，中心から36年輪,0,material wood year ring C14 wiggle matching sample from center,,material wood year ring C14 wiggle matching sample from center,
921,Wood,木材，ウイグルマッチング，中心から46年輪,0,material wood year ring C14 wiggle matching sample from center,,material wood year ring C14 wiggle matching sample from center,
922,Wood,木材，ウイグルマッチング，中心から6年輪,0,material wood year ring C14 wiggle matching sample from center,,material wood year ring C14 wiggle matching sample from center,
923,Wood,木材，ウイグルマッチング，中間30層目,0,material wood C14 wiggle matching sample,,material wood C14 wiggle matching sample,
924,Wood,木材，ウイグルマッチング，最も内側,0,material wood C14 wiggle matching sample inside,,material wood C14 wiggle matching sample inside,
925,Wood,木材，ウイグルマッチング，最内60層目,0,material wood C14 wiggle matching sample,,material wood C14 wiggle matching sample,
926,Wood,木材，ウイグルマッチング，最内から100層目,0,material wood C14 wiggle matching sample from center,,material wood C14 wiggle matching sample from center,
927,Wood,木材，ウイグルマッチング，最内から10層目,0,material wood C14 wiggle matching sample from center,,material wood C14 wiggle matching sample from center,
928,Wood,木材，ウイグルマッチング，最内から110層目,0,material wood C14 wiggle matching sample from center,,material wood C14 wiggle matching sample from center,
929,Wood,木材，ウイグルマッチング，最内から20層目,0,material wood C14 wiggle matching sample from center,,material wood C14 wiggle matching sample from center,
930,Wood,木材，ウイグルマッチング，最内から30層目,0,material wood C14 wiggle matching sample from center,,material wood C14 wiggle matching sample from center,
931,Wood,木材，ウイグルマッチング，最内から40層目,0,material wood C14 wiggle matching sample from center,,material wood C14 wiggle matching sample from center,
932,Wood,木材，ウイグルマッチング，最内から50層目,0,material wood C14 wiggle matching sample from center,,material wood C14 wiggle matching sample from center,
933,Wood,木材，ウイグルマッチング，最内から60層目,0,material wood C14 wiggle matching sample from center,,material wood C14 wiggle matching sample from center,
934,Wood,木材，ウイグルマッチング，最内から70層目,0,material wood C14 wiggle matching sample from center,,material wood C14 wiggle matching sample from center,
935,Wood,木材，ウイグルマッチング，最内から80層目,0,material wood C14 wiggle matching sample from center,,material wood C14 wiggle matching sample from center,
936,Wood,木材，ウイグルマッチング，最内から90層目,0,material wood C14 wiggle matching sample from center,,material wood C14 wiggle matching sample from center,
937,Wood,木材，ウイグルマッチング，最外1層目,0,material wood outermost C14 wiggle matching sample,,material wood outermost C14 wiggle matching sample,
938,Wood,木材，ウイグルマッチング，最外から1-5,0,material wood outermost C14 wiggle matching sample from outermost,,material wood outermost C14 wiggle matching sample from outermost,
939,Wood,木材，ウイグルマッチング，最外から11-15,0,material wood outermost C14 wiggle matching sample from outermost,,material wood outermost C14 wiggle matching sample from outermost,
940,Wood,木材，ウイグルマッチング，最外から11年輪,0,material wood outermost year ring C14 wiggle matching sample from outermost,,material wood outermost year ring C14 wiggle matching sample from outermost,
941,Wood,木材，ウイグルマッチング，最外から21-25,0,material wood outermost C14 wiggle matching sample from outermost,,material wood outermost C14 wiggle matching sample from outermost,
942,Wood,木材，ウイグルマッチング，最外から21年輪,0,material wood outermost year ring C14 wiggle matching sample from outermost,,material wood outermost year ring C14 wiggle matching sample from outermost,
943,Wood,木材，ウイグルマッチング，最外から26-29,0,material wood outermost C14 wiggle matching sample from outermost,,material wood outermost C14 wiggle matching sample from outermost,
944,Wood,木材，ウイグルマッチング，最外から26-30,0,material wood outermost C14 wiggle matching sample from outermost,,material wood outermost C14 wiggle matching sample from outermost,
945,Wood,木材，ウイグルマッチング，最外から31-35,0,material wood outermost C14 wiggle matching sample from outermost,,material wood outermost C14 wiggle matching sample from outermost,
946,Wood,木材，ウイグルマッチング，最外から31年輪,0,material wood outermost year ring C14 wiggle matching sample from outermost,,material wood outermost year ring C14 wiggle matching sample from outermost,
947,Wood,木材，ウイグルマッチング，最外から41年輪,0,material wood outermost year ring C14 wiggle matching sample from outermost,,material wood outermost year ring C14 wiggle matching sample from outermost,
948,Wood,木材，ウイグルマッチング，最外から49年輪,0,material wood outermost year ring C14 wiggle matching sample from outermost,,material wood outermost year ring C14 wiggle matching sample from outermost,
949,Wood,木材，ウイグルマッチング，最外から5年輪,0,material wood outermost year ring C14 wiggle matching sample from outermost,,material wood outermost year ring C14 wiggle matching sample from outermost,
950,Wood,木材，ウイグルマッチング，外から1-5年輪,0,material wood year ring C14 wiggle matching sample from outermost,,material wood year ring C14 wiggle matching sample from outermost,
951,Wood,木材，ウイグルマッチング，外から101輪,0,material wood C14 wiggle matching sample from outermost,,material wood C14 wiggle matching sample from outermost,
952,Wood,木材，ウイグルマッチング，外から11-15年輪,0,material wood year ring C14 wiggle matching sample from outermost,,material wood year ring C14 wiggle matching sample from outermost,
953,Wood,木材，ウイグルマッチング，外から11-20年輪,0,material wood year ring C14 wiggle matching sample from outermost,,material wood year ring C14 wiggle matching sample from outermost,
954,Wood,木材，ウイグルマッチング，外から111-115年輪,0,material wood year ring C14 wiggle matching sample from outermost,,material wood year ring C14 wiggle matching sample from outermost,
955,Wood,木材，ウイグルマッチング，外から11年輪,0,material wood year ring C14 wiggle matching sample from outermost,,material wood year ring C14 wiggle matching sample from outermost,
956,Wood,木材，ウイグルマッチング，外から11年輪目,0,material wood year ring C14 wiggle matching sample from outermost,,material wood year ring C14 wiggle matching sample from outermost,
957,Wood,木材，ウイグルマッチング，外から121-130年輪,0,material wood year ring C14 wiggle matching sample from outermost,,material wood year ring C14 wiggle matching sample from outermost,
958,Wood,木材，ウイグルマッチング，外から131-135年輪,0,material wood year ring C14 wiggle matching sample from outermost,,material wood year ring C14 wiggle matching sample from outermost,
959,Wood,木材，ウイグルマッチング，外から131年輪目,0,material wood year ring C14 wiggle matching sample from outermost,,material wood year ring C14 wiggle matching sample from outermost,
960,Wood,木材，ウイグルマッチング，外から151-160年輪,0,material wood year ring C14 wiggle matching sample from outermost,,material wood year ring C14 wiggle matching sample from outermost,
961,Wood,木材，ウイグルマッチング，外から16-20年輪,0,material wood year ring C14 wiggle matching sample from outermost,,material wood year ring C14 wiggle matching sample from outermost,
962,Wood,木材，ウイグルマッチング，外から191-200年輪,0,material wood year ring C14 wiggle matching sample from outermost,,material wood year ring C14 wiggle matching sample from outermost,
963,Wood,木材，ウイグルマッチング，外から1年輪,0,material wood year ring C14 wiggle matching sample from outermost,,material wood year ring C14 wiggle matching sample from outermost,
964,Wood,木材，ウイグルマッチング，外から1年輪目,0,material wood year ring C14 wiggle matching sample from outermost,,material wood year ring C14 wiggle matching sample from outermost,
965,Wood,木材，ウイグルマッチング，外から21-25年輪,0,material wood year ring C14 wiggle matching sample from outermost,,material wood year ring C14 wiggle matching sample from outermost,
966,Wood,木材，ウイグルマッチング，外から21年輪,0,material wood year ring C14 wiggle matching sample from outermost,,material wood year ring C14 wiggle matching sample from outermost,
967,Wood,木材，ウイグルマッチング，外から21年輪目,0,material wood year ring C14 wiggle matching sample from outermost,,material wood year ring C14 wiggle matching sample from outermost,
968,Wood,木材，ウイグルマッチング，外から231-240年輪,0,material wood year ring C14 wiggle matching sample from outermost,,material wood year ring C14 wiggle matching sample from outermost,
969,Wood,木材，ウイグルマッチング，外から26-30年輪,0,material wood year ring C14 wiggle matching sample from outermost,,material wood year ring C14 wiggle matching sample from outermost,
970,Wood,木材，ウイグルマッチング，外から31-35年輪,0,material wood year ring C14 wiggle matching sample from outermost,,material wood year ring C14 wiggle matching sample from outermost,
971,Wood,木材，ウイグルマッチング，外から31年輪,0,,,material wood year ring C14 wiggle matching sample from outermost,
972,Wood,木材，ウイグルマッチング，外から31年輪目,0,material wood year ring C14 wiggle matching sample from outermost,,material wood year ring C14 wiggle matching sample from outermost,
973,Wood,木材，ウイグルマッチング，外から36-40年輪,0,material wood year ring C14 wiggle matching sample from outermost,,material wood year ring C14 wiggle matching sample from outermost,
974,Wood,木材，ウイグルマッチング，外から41-45年輪,0,material wood year ring C14 wiggle matching sample from outermost,,material wood year ring C14 wiggle matching sample from outermost,
975,Wood,木材，ウイグルマッチング，外から41年輪,0,material wood year ring C14 wiggle matching sample from outermost,,material wood year ring C14 wiggle matching sample from outermost,
976,Wood,木材，ウイグルマッチング，外から41年輪目,0,material wood year ring C14 wiggle matching sample from outermost,,material wood year ring C14 wiggle matching sample from outermost,
977,Wood,木材，ウイグルマッチング，外から51-55年輪,0,material wood year ring C14 wiggle matching sample from outermost,,material wood year ring C14 wiggle matching sample from outermost,
978,Wood,木材，ウイグルマッチング，外から51-60年輪,0,material wood year ring C14 wiggle matching sample from outermost,,material wood year ring C14 wiggle matching sample from outermost,
979,Wood,木材，ウイグルマッチング，外から51年輪,0,material wood year ring C14 wiggle matching sample from outermost,,material wood year ring C14 wiggle matching sample from outermost,
980,Wood,木材，ウイグルマッチング，外から51年輪目,0,material wood year ring C14 wiggle matching sample from outermost,,material wood year ring C14 wiggle matching sample from outermost,
981,Wood,木材，ウイグルマッチング，外から6-10年輪,0,material wood year ring C14 wiggle matching sample from outermost,,material wood year ring C14 wiggle matching sample from outermost,
982,Wood,木材，ウイグルマッチング，外から61年輪,0,material wood year ring C14 wiggle matching sample from outermost,,material wood year ring C14 wiggle matching sample from outermost,
983,Wood,木材，ウイグルマッチング，外から61年輪目,0,material wood year ring C14 wiggle matching sample from outermost,,material wood year ring C14 wiggle matching sample from outermost,
984,Wood,木材，ウイグルマッチング，外から71-75年輪,0,material wood year ring C14 wiggle matching sample from outermost,,material wood year ring C14 wiggle matching sample from outermost,
985,Wood,木材，ウイグルマッチング，外から71年輪,0,material wood year ring C14 wiggle matching sample from outermost,,material wood year ring C14 wiggle matching sample from outermost,
986,Wood,木材，ウイグルマッチング，外から81年輪,0,material wood year ring C14 wiggle matching sample from outermost,,material wood year ring C14 wiggle matching sample from outermost,
987,Wood,木材，ウイグルマッチング，外から91-100年輪,0,material wood year ring C14 wiggle matching sample from outermost,,material wood year ring C14 wiggle matching sample from outermost,
988,Wood,木材，ウイグルマッチング，外から91-95年輪,0,material wood year ring C14 wiggle matching sample from outermost,,material wood year ring C14 wiggle matching sample from outermost,
